Number	Title	Faculty	Semester	Section	Credits	Modality**
T510X	Digital Media Literacy: The Medium	Richards, John	Spring 2	1	2	IP
T511A	Student Project Studio: Identifying Context Relevant Learner Variability	Dockterman, David	Spring 1	1	1	TBD
T511B	Student Project Studio: Addressing Learning Processes	Dockterman, David	Spring 1	1	1	TBD
T511C	Student Project Studio: Making it Adaptive	Dockterman, David	Spring 2	1	1	TBD
T511D	Student Project Studio: Creating Conditions for Product Impact	Dockterman, David	Spring 2	1	1	TBD
T511J	Effectively Implementing Learning Technologies to Address Global and Local Challenges	Dede, Chris	Fall 1	1	2	O
T511K	Transforming Education through Emerging Technologies	Dede, Chris	Fall 2	1	2	O
T514	Multi-Modal Learning Analytics	Schneider, Bertrand	Fall	1	4	O
T519	Digital Fabrication and Making in Education	Schneider, Bertrand	Spring	1	4	IP
T521	Designing K–12 Computer Science Learning Experiences	Brennan, Karen	Spring	1	4	IP
T521	Classroom Discourse: A research practicum in analyzing and studying classroom talk	Snow, Catherine	Spring	1	4	IP
T521M	Classroom Discourse: An introduction to teacher-student talk	Snow, Catherine	January	1	2	O
T522	Innovation by Design: Projects in Educational Technology	Dockterman, David	Fall	1	4	IP
T523	Formative Evaluation for Educational Product Development	Reich, Christina	Spring	1	4	IP
T525	Connected Teaching in the Digital Age	Treacy, Barbara	Spring	1	4	O
T543	Applying Cognitive Science to Learning and Teaching	Grotzer, Tina	Spring	1	4	FLEX
T545	Motivation and Learning: Technologies That Invite and Immerse	Dede, Chris	Spring	1	4	O
T550	Designing for Learning by Creating	Brennan, Karen	Fall	1	4	IP
T560	Universal Design for Learning: Theory, Practice, and Innovation	Blackorby, Jose; Hartmann, Elizabeth	Spring	1	4	O
T565	Entrepreneurship in the Education Marketplace	Richards, John	Fall	1	4	FLEX
T581	Advanced Design Studio	Rosenheck, Louisa	Spring	1	4	IP
T598	Field Experience in Electronic Technology & Education	Various	Various	Various	4	O
T802A	Teaching Climate Change	Grotzer, Tina	Fall 2	1	2	O
T803A	Teaching Climate Change	Grotzer, Tina	Spring	1	2	O
T909	Research Seminar on Teacher and Teaching Quality	Hill, Heather; Taylor, Eric	Spring	1	4	IP
TBD	Group independent study - Superintendent Practicum	Echelson, Drew	Fall	1	4	IP
TBD	Group independent study - Superintendent Practicum	Echelson, Drew	Spring	1	4	IP
TBD	The College Admissions Process: Practice, Policy, and Research	Perez, Angel	January	1	2	O
TBD	Reading Group on Research Methods in Educational Neuroscience	Ozernov-Palchik, Ola	Spring	1	2	O